backbone/analisys/metr-la/metr-la-by-nois_corr-with-alpah_filter0_1/csv/all_network_summary.csv

graph_name,dataset,role,source_path,num_nodes,num_edges,density,average_degree,average_strength,edge_weight_mean,edge_weight_median,edge_weight_std,edge_weight_min,edge_weight_max,average_clustering,average_weighted_clustering,transitivity,local_efficiency_mean,edge_overlap_mean,is_connected,num_connected_components,giant_component_size,giant_component_ratio,node_connectivity_gcc,edge_connectivity_gcc,degree_assortativity,num_communities,modularity,largest_community_size,largest_community_ratio,avg_path_length_gcc,median_path_length_gcc,p90_path_length_gcc,diameter_gcc,avg_weighted_distance_gcc,global_efficiency
metr-la-by-nois_corr-with-alpah_filter0_1,metr-la,backbone,/home/varlson/master/main/master-main/data/GraphML/metr-la-by-nois_corr-with-alpah_filter0_1.GraphML,207,378,0.017728999577880964,3.652173913043478,2.2599255819827464,0.6187891474476567,0.6562770903110504,0.25406368649909655,0.10252758115530014,0.9998319149017334,0.36625258799171845,0.232452851432401,0.3632514817950889,0.42895100069013115,0.24457461997144536,False,5,202,0.9758454106280193,1.0,1.0,0.23681733817753628,20,0.8345928228863325,23,0.1111111111111111,11.451357076006108,11.0,20.0,29.0,22.09907158460475,0.13453641722946344
metr-la,metr-la,original,/home/varlson/master/main/master-main/data/GraphML/metr-la.GraphML,207,1313,0.061582477369729376,12.68599033816425,5.144801216424951,0.4055498293221496,0.3212842345237732,0.2664214215354655,0.10008397698402405,0.9998319149017334,0.5484908174323528,0.22063398549839594,0.5510989624009818,0.7472739491051362,0.3876396025686644,False,2,206,0.9951690821256038,2.0,2.0,0.46162532528411615,8,0.6978109147260045,53,0.2560386473429952,5.063746152024627,5.0,9.0,13.0,15.559703731966676,0.27886506280697293

backbone/analisys/metr-la/metr-la-by-nois_corr-with-alpah_filter0_1/md/report.md

### Rede Original

- Nos: 207 | Arestas: 1313 | Densidade: 0.0616
- Grau medio: 12.6860 | Forca media: 5.1448
- Clustering medio: 0.5485 | Eficiencia global: 0.2789 | Modularidade: 0.6978
- Caminho medio (gcc): 5.0637 | Componentes: 2 | Assortatividade: 0.4616

#### metr-la-by-nois_corr-with-alpah_filter0_1

Informacoes basicas do backbone:
- Nos: 207 | Delta: -0.00%
- Arestas: 378 | Delta: -71.21%
- Densidade: 0.0177 | Delta: -71.21%
- Grau medio: 3.6522 | Forca media: 2.2599
- Componentes: 5 | Razao do componente gigante: 0.9758 | Delta GCC: -1.94%
- Clustering medio: 0.3663 | Delta: -33.23%
- Eficiencia global: 0.1345 | Delta: -51.76%
- Caminho medio (gcc): 11.4514 | Delta: +126.14%
- Modularidade: 0.8346 | Delta: +0.1368
- Assortatividade: 0.2368 | Delta: -0.2248
- Comunidades: 20 | Maior comunidade: 23
- Robustez aleatoria (AUC LCC): 0.2498 | Delta: -45.20%
- Robustez alvo (AUC LCC): 0.1543 | Delta: -60.19%