results/csv/all-datasets_20260304_163952_consolidated_experiments.csv

experiment_name,model,dataset,test_loss,mae,rmse,mape,params,metadata_run_id,metadata_device,metadata_num_nodes,metadata_seq_len,metadata_horizon,metadata_batch_size,metadata_normalization_stats,metadata_total_configs,metadata_best_result,timestamp
pems-bay_DCRNN_20260304_163952,DCRNN,pems-bay,0.2810525117409083,0.2841019332408905,0.5302886962890625,168.0164031982422,"{'input_dim': 1, 'hidden_dim': 64, 'output_dim': 1, 'seq_len': 12, 'horizon': 12, 'k': 2, 'dropout': 0.1, 'lr': 0.001, 'weight_decay': 0.0001, 'epochs': 50, 'patience': 5, 'use_scheduled_sampling': False, 'teacher_forcing_ratio': 0.5}",20260304_163952,cuda,325,12,12,8,"{'method': 'zscore', 'mean': 62.73689571599971, 'std': 9.436833092265356}",1,"{'params': {'input_dim': 1, 'hidden_dim': 64, 'output_dim': 1, 'seq_len': 12, 'horizon': 12, 'k': 2, 'dropout': 0.1, 'lr': 0.001, 'weight_decay': 0.0001, 'epochs': 50, 'patience': 5, 'use_scheduled_sampling': False, 'teacher_forcing_ratio': 0.5}, 'test_loss': 0.2810525117409083, 'mae': 0.2841019332408905, 'rmse': 0.5302886962890625, 'mape': 168.0164031982422}",2026-03-04T23:15:30.993817
pems-bay_GraphWaveNet_20260304_163952,GraphWaveNet,pems-bay,0.20693180243771733,0.22441643476486206,0.4550148546695709,130.47976684570312,"{'input_dim': 1, 'hidden_dim': 64, 'output_dim': 1, 'seq_len': 12, 'horizon': 12, 'num_blocks': 3, 'dilation_base': 2, 'k': 2, 'dropout': 0.1, 'lr': 0.001, 'weight_decay': 0.0001, 'epochs': 50, 'patience': 5}",20260304_163952,cuda,325,12,12,8,"{'method': 'zscore', 'mean': 62.73689571599971, 'std': 9.436833092265356}",1,"{'params': {'input_dim': 1, 'hidden_dim': 64, 'output_dim': 1, 'seq_len': 12, 'horizon': 12, 'num_blocks': 3, 'dilation_base': 2, 'k': 2, 'dropout': 0.1, 'lr': 0.001, 'weight_decay': 0.0001, 'epochs': 50, 'patience': 5}, 'test_loss': 0.20693180243771733, 'mae': 0.22441643476486206, 'rmse': 0.4550148546695709, 'mape': 130.47976684570312}",2026-03-04T23:15:30.994066
pems-bay_MTGNN_20260304_163952,MTGNN,pems-bay,0.2630731001092575,0.2358754426240921,0.5130516886711121,130.7735137939453,"{'input_dim': 1, 'hidden_dim': 64, 'output_dim': 1, 'seq_len': 12, 'horizon': 12, 'num_blocks': 3, 'kernel_size': 2, 'dilation_base': 2, 'gcn_depth': 2, 'propalpha': 0.05, 'node_dim': 16, 'dropout': 0.1, 'lr': 0.001, 'weight_decay': 0.0001, 'epochs': 50, 'patience': 5}",20260304_163952,cuda,325,12,12,8,"{'method': 'zscore', 'mean': 62.73689571599971, 'std': 9.436833092265356}",1,"{'params': {'input_dim': 1, 'hidden_dim': 64, 'output_dim': 1, 'seq_len': 12, 'horizon': 12, 'num_blocks': 3, 'kernel_size': 2, 'dilation_base': 2, 'gcn_depth': 2, 'propalpha': 0.05, 'node_dim': 16, 'dropout': 0.1, 'lr': 0.001, 'weight_decay': 0.0001, 'epochs': 50, 'patience': 5}, 'test_loss': 0.2630731001092575, 'mae': 0.2358754426240921, 'rmse': 0.5130516886711121, 'mape': 130.7735137939453}",2026-03-04T23:15:30.994297
pems-bay_DGCRN_20260304_163952,DGCRN,pems-bay,0.25732581742783633,0.269620418548584,0.507402777671814,189.0216064453125,"{'input_dim': 1, 'hidden_dim': 64, 'output_dim': 1, 'seq_len': 12, 'horizon': 12, 'node_dim': 16, 'gcn_depth': 2, 'dropout': 0.1, 'lr': 0.001, 'weight_decay': 0.0001, 'epochs': 50, 'patience': 5}",20260304_163952,cuda,325,12,12,8,"{'method': 'zscore', 'mean': 62.73689571599971, 'std': 9.436833092265356}",1,"{'params': {'input_dim': 1, 'hidden_dim': 64, 'output_dim': 1, 'seq_len': 12, 'horizon': 12, 'node_dim': 16, 'gcn_depth': 2, 'dropout': 0.1, 'lr': 0.001, 'weight_decay': 0.0001, 'epochs': 50, 'patience': 5}, 'test_loss': 0.25732581742783633, 'mae': 0.269620418548584, 'rmse': 0.507402777671814, 'mape': 189.0216064453125}",2026-03-04T23:15:30.994524
pems-bay_STICformer_20260304_163952,STICformer,pems-bay,0.18744252257401284,0.20144253969192505,0.4330718517303467,117.85782623291016,"{'input_dim': 1, 'hidden_dim': 64, 'output_dim': 1, 'seq_len': 12, 'horizon': 12, 'num_layers': 2, 'num_heads': 4, 'ff_multiplier': 2, 'dropout': 0.1, 'lr': 0.001, 'weight_decay': 0.0001, 'epochs': 50, 'patience': 5}",20260304_163952,cuda,325,12,12,8,"{'method': 'zscore', 'mean': 62.73689571599971, 'std': 9.436833092265356}",1,"{'params': {'input_dim': 1, 'hidden_dim': 64, 'output_dim': 1, 'seq_len': 12, 'horizon': 12, 'num_layers': 2, 'num_heads': 4, 'ff_multiplier': 2, 'dropout': 0.1, 'lr': 0.001, 'weight_decay': 0.0001, 'epochs': 50, 'patience': 5}, 'test_loss': 0.18744252257401284, 'mae': 0.20144253969192505, 'rmse': 0.4330718517303467, 'mape': 117.85782623291016}",2026-03-04T23:15:30.994720
pems-bay_PatchSTG_20260304_163952,PatchSTG,pems-bay,0.18871854185244838,0.20830927789211273,0.43454357981681824,124.90058135986328,"{'input_dim': 1, 'hidden_dim': 64, 'output_dim': 1, 'seq_len': 12, 'horizon': 12, 'patch_len': 4, 'patch_stride': 2, 'num_layers': 2, 'num_heads': 4, 'ff_multiplier': 2, 'dropout': 0.1, 'lr': 0.001, 'weight_decay': 0.0001, 'epochs': 50, 'patience': 5}",20260304_163952,cuda,325,12,12,8,"{'method': 'zscore', 'mean': 62.73689571599971, 'std': 9.436833092265356}",1,"{'params': {'input_dim': 1, 'hidden_dim': 64, 'output_dim': 1, 'seq_len': 12, 'horizon': 12, 'patch_len': 4, 'patch_stride': 2, 'num_layers': 2, 'num_heads': 4, 'ff_multiplier': 2, 'dropout': 0.1, 'lr': 0.001, 'weight_decay': 0.0001, 'epochs': 50, 'patience': 5}, 'test_loss': 0.18871854185244838, 'mae': 0.20830927789211273, 'rmse': 0.43454357981681824, 'mape': 124.90058135986328}",2026-03-04T23:15:30.994906
metr-la_DCRNN_20260304_163952,DCRNN,metr-la,0.3905977067914933,0.34448111057281494,0.6249781847000122,121.20404052734375,"{'input_dim': 1, 'hidden_dim': 64, 'output_dim': 1, 'seq_len': 12, 'horizon': 12, 'k': 2, 'dropout': 0.1, 'lr': 0.001, 'weight_decay': 0.0001, 'epochs': 50, 'patience': 5, 'use_scheduled_sampling': False, 'teacher_forcing_ratio': 0.5}",20260304_163952,cuda,207,12,12,8,"{'method': 'zscore', 'mean': 54.40591191569834, 'std': 19.494251201218937}",1,"{'params': {'input_dim': 1, 'hidden_dim': 64, 'output_dim': 1, 'seq_len': 12, 'horizon': 12, 'k': 2, 'dropout': 0.1, 'lr': 0.001, 'weight_decay': 0.0001, 'epochs': 50, 'patience': 5, 'use_scheduled_sampling': False, 'teacher_forcing_ratio': 0.5}, 'test_loss': 0.3905977067914933, 'mae': 0.34448111057281494, 'rmse': 0.6249781847000122, 'mape': 121.20404052734375}",2026-03-04T23:15:30.995089
metr-la_GraphWaveNet_20260304_163952,GraphWaveNet,metr-la,0.3843751299506887,0.31386640667915344,0.6199799180030823,110.92346954345703,"{'input_dim': 1, 'hidden_dim': 64, 'output_dim': 1, 'seq_len': 12, 'horizon': 12, 'num_blocks': 3, 'dilation_base': 2, 'k': 2, 'dropout': 0.1, 'lr': 0.001, 'weight_decay': 0.0001, 'epochs': 50, 'patience': 5}",20260304_163952,cuda,207,12,12,8,"{'method': 'zscore', 'mean': 54.40591191569834, 'std': 19.494251201218937}",1,"{'params': {'input_dim': 1, 'hidden_dim': 64, 'output_dim': 1, 'seq_len': 12, 'horizon': 12, 'num_blocks': 3, 'dilation_base': 2, 'k': 2, 'dropout': 0.1, 'lr': 0.001, 'weight_decay': 0.0001, 'epochs': 50, 'patience': 5}, 'test_loss': 0.3843751299506887, 'mae': 0.31386640667915344, 'rmse': 0.6199799180030823, 'mape': 110.92346954345703}",2026-03-04T23:15:30.995271
metr-la_MTGNN_20260304_163952,MTGNN,metr-la,0.4018265298487012,0.34684890508651733,0.6338979005813599,122.34736633300781,"{'input_dim': 1, 'hidden_dim': 64, 'output_dim': 1, 'seq_len': 12, 'horizon': 12, 'num_blocks': 3, 'kernel_size': 2, 'dilation_base': 2, 'gcn_depth': 2, 'propalpha': 0.05, 'node_dim': 16, 'dropout': 0.1, 'lr': 0.001, 'weight_decay': 0.0001, 'epochs': 50, 'patience': 5}",20260304_163952,cuda,207,12,12,8,"{'method': 'zscore', 'mean': 54.40591191569834, 'std': 19.494251201218937}",1,"{'params': {'input_dim': 1, 'hidden_dim': 64, 'output_dim': 1, 'seq_len': 12, 'horizon': 12, 'num_blocks': 3, 'kernel_size': 2, 'dilation_base': 2, 'gcn_depth': 2, 'propalpha': 0.05, 'node_dim': 16, 'dropout': 0.1, 'lr': 0.001, 'weight_decay': 0.0001, 'epochs': 50, 'patience': 5}, 'test_loss': 0.4018265298487012, 'mae': 0.34684890508651733, 'rmse': 0.6338979005813599, 'mape': 122.34736633300781}",2026-03-04T23:15:30.995454
metr-la_DGCRN_20260304_163952,DGCRN,metr-la,0.3982522316196327,0.27565035223960876,0.6310722827911377,125.6170883178711,"{'input_dim': 1, 'hidden_dim': 64, 'output_dim': 1, 'seq_len': 12, 'horizon': 12, 'node_dim': 16, 'gcn_depth': 2, 'dropout': 0.1, 'lr': 0.001, 'weight_decay': 0.0001, 'epochs': 50, 'patience': 5}",20260304_163952,cuda,207,12,12,8,"{'method': 'zscore', 'mean': 54.40591191569834, 'std': 19.494251201218937}",1,"{'params': {'input_dim': 1, 'hidden_dim': 64, 'output_dim': 1, 'seq_len': 12, 'horizon': 12, 'node_dim': 16, 'gcn_depth': 2, 'dropout': 0.1, 'lr': 0.001, 'weight_decay': 0.0001, 'epochs': 50, 'patience': 5}, 'test_loss': 0.3982522316196327, 'mae': 0.27565035223960876, 'rmse': 0.6310722827911377, 'mape': 125.6170883178711}",2026-03-04T23:15:30.995636
metr-la_STICformer_20260304_163952,STICformer,metr-la,0.3758536023534922,0.304765909910202,0.6130689978599548,119.42132568359375,"{'input_dim': 1, 'hidden_dim': 64, 'output_dim': 1, 'seq_len': 12, 'horizon': 12, 'num_layers': 2, 'num_heads': 4, 'ff_multiplier': 2, 'dropout': 0.1, 'lr': 0.001, 'weight_decay': 0.0001, 'epochs': 50, 'patience': 5}",20260304_163952,cuda,207,12,12,8,"{'method': 'zscore', 'mean': 54.40591191569834, 'std': 19.494251201218937}",1,"{'params': {'input_dim': 1, 'hidden_dim': 64, 'output_dim': 1, 'seq_len': 12, 'horizon': 12, 'num_layers': 2, 'num_heads': 4, 'ff_multiplier': 2, 'dropout': 0.1, 'lr': 0.001, 'weight_decay': 0.0001, 'epochs': 50, 'patience': 5}, 'test_loss': 0.3758536023534922, 'mae': 0.304765909910202, 'rmse': 0.6130689978599548, 'mape': 119.42132568359375}",2026-03-04T23:15:30.995817
metr-la_PatchSTG_20260304_163952,PatchSTG,metr-la,0.3714318419294105,0.29366356134414673,0.6094520688056946,116.23175048828125,"{'input_dim': 1, 'hidden_dim': 64, 'output_dim': 1, 'seq_len': 12, 'horizon': 12, 'patch_len': 4, 'patch_stride': 2, 'num_layers': 2, 'num_heads': 4, 'ff_multiplier': 2, 'dropout': 0.1, 'lr': 0.001, 'weight_decay': 0.0001, 'epochs': 50, 'patience': 5}",20260304_163952,cuda,207,12,12,8,"{'method': 'zscore', 'mean': 54.40591191569834, 'std': 19.494251201218937}",1,"{'params': {'input_dim': 1, 'hidden_dim': 64, 'output_dim': 1, 'seq_len': 12, 'horizon': 12, 'patch_len': 4, 'patch_stride': 2, 'num_layers': 2, 'num_heads': 4, 'ff_multiplier': 2, 'dropout': 0.1, 'lr': 0.001, 'weight_decay': 0.0001, 'epochs': 50, 'patience': 5}, 'test_loss': 0.3714318419294105, 'mae': 0.29366356134414673, 'rmse': 0.6094520688056946, 'mape': 116.23175048828125}",2026-03-04T23:15:30.995998

results/md/metr-la_20260304_163952_comparison_report.md

### DCRNN

- Experimentos: 1
- MAE médio: 0.3445 ± nan
- RMSE médio: 0.6250 ± nan
- MAPE médio: 121.20% ± nan%

### GraphWaveNet

- Experimentos: 1
- MAE médio: 0.3139 ± nan
- RMSE médio: 0.6200 ± nan
- MAPE médio: 110.92% ± nan%

### MTGNN

- Experimentos: 1
- MAE médio: 0.3468 ± nan
- RMSE médio: 0.6339 ± nan
- MAPE médio: 122.35% ± nan%

### DGCRN

- Experimentos: 1
- MAE médio: 0.2757 ± nan
- RMSE médio: 0.6311 ± nan
- MAPE médio: 125.62% ± nan%

### STICformer

- Experimentos: 1
- MAE médio: 0.3048 ± nan
- RMSE médio: 0.6131 ± nan
- MAPE médio: 119.42% ± nan%

### PatchSTG

- Experimentos: 1
- MAE médio: 0.2937 ± nan
- RMSE médio: 0.6095 ± nan
- MAPE médio: 116.23% ± nan%

### metr-la

- **Melhor modelo:** DGCRN
- **Experimento:** metr-la_DGCRN_20260304_163952
- **MAE:** 0.2757
- **RMSE:** 0.6311
- **MAPE:** 125.62%
- **Parâmetros:** `{'input_dim': 1, 'hidden_dim': 64, 'output_dim': 1, 'seq_len': 12, 'horizon': 12, 'node_dim': 16, 'gcn_depth': 2, 'dropout': 0.1, 'lr': 0.001, 'weight_decay': 0.0001, 'epochs': 50, 'patience': 5}`