backbone/analisys/metr-la/metr-la-by-nois_corr-with-alpah_filter0_3/csv/all_network_summary.csv

graph_name,dataset,role,source_path,num_nodes,num_edges,density,average_degree,average_strength,edge_weight_mean,edge_weight_median,edge_weight_std,edge_weight_min,edge_weight_max,average_clustering,average_weighted_clustering,transitivity,local_efficiency_mean,edge_overlap_mean,is_connected,num_connected_components,giant_component_size,giant_component_ratio,node_connectivity_gcc,edge_connectivity_gcc,degree_assortativity,num_communities,modularity,largest_community_size,largest_community_ratio,avg_path_length_gcc,median_path_length_gcc,p90_path_length_gcc,diameter_gcc,avg_weighted_distance_gcc,global_efficiency
metr-la-by-nois_corr-with-alpah_filter0_3,metr-la,backbone,/home/varlson/master/main/master-main/data/GraphML/metr-la-by-nois_corr-with-alpah_filter0_3.GraphML,207,1022,0.04793396182167816,9.8743961352657,4.6732155160195585,0.4732659549002195,0.42075692117214203,0.26330347166775336,0.10068466514348984,0.9998319149017334,0.4828596705621428,0.2336419881941013,0.4562252964426877,0.6984777280543123,0.31430981988102086,False,2,206,0.9951690821256038,2.0,2.0,0.2622131322469057,8,0.7094141663795064,53,0.2560386473429952,5.52919725313758,5.0,9.0,14.0,15.577244010911903,0.25452933750740614
metr-la,metr-la,original,/home/varlson/master/main/master-main/data/GraphML/metr-la.GraphML,207,1313,0.061582477369729376,12.68599033816425,5.144801216424951,0.4055498293221496,0.3212842345237732,0.2664214215354655,0.10008397698402405,0.9998319149017334,0.5484908174323528,0.22063398549839594,0.5510989624009818,0.7472739491051362,0.3876396025686644,False,2,206,0.9951690821256038,2.0,2.0,0.46162532528411615,8,0.6978109147260045,53,0.2560386473429952,5.063746152024627,5.0,9.0,13.0,15.559703731966676,0.27886506280697293

backbone/analisys/metr-la/metr-la-by-nois_corr-with-alpah_filter0_3/md/report.md

### Rede Original

- Nos: 207 | Arestas: 1313 | Densidade: 0.0616
- Grau medio: 12.6860 | Forca media: 5.1448
- Clustering medio: 0.5485 | Eficiencia global: 0.2789 | Modularidade: 0.6978
- Caminho medio (gcc): 5.0637 | Componentes: 2 | Assortatividade: 0.4616

#### metr-la-by-nois_corr-with-alpah_filter0_3

Informacoes basicas do backbone:
- Nos: 207 | Delta: -0.00%
- Arestas: 1022 | Delta: -22.16%
- Densidade: 0.0479 | Delta: -22.16%
- Grau medio: 9.8744 | Forca media: 4.6732
- Componentes: 2 | Razao do componente gigante: 0.9952 | Delta GCC: 0.00%
- Clustering medio: 0.4829 | Delta: -11.97%
- Eficiencia global: 0.2545 | Delta: -8.73%
- Caminho medio (gcc): 5.5292 | Delta: +9.19%
- Modularidade: 0.7094 | Delta: +0.0116
- Assortatividade: 0.2622 | Delta: -0.1994
- Comunidades: 8 | Maior comunidade: 53
- Robustez aleatoria (AUC LCC): 0.4363 | Delta: -4.28%
- Robustez alvo (AUC LCC): 0.3553 | Delta: -8.35%