backbone/analisys/pems-bay/pems-bay-by-high_sal-with-alpah_filter0_4/csv/pems-bay_network_summary.csv

graph_name,dataset,role,source_path,num_nodes,num_edges,density,average_degree,average_strength,edge_weight_mean,edge_weight_median,edge_weight_std,edge_weight_min,edge_weight_max,average_clustering,average_weighted_clustering,transitivity,local_efficiency_mean,edge_overlap_mean,is_connected,num_connected_components,giant_component_size,giant_component_ratio,node_connectivity_gcc,edge_connectivity_gcc,degree_assortativity,num_communities,modularity,largest_community_size,largest_community_ratio,avg_path_length_gcc,median_path_length_gcc,p90_path_length_gcc,diameter_gcc,avg_weighted_distance_gcc,global_efficiency
pems-bay-by-high_sal-with-alpah_filter0_4,pems-bay,backbone,/home/suleimane/master/main/master-main/data/GraphML/pems-bay-by-high_sal-with-alpah_filter0_4.GraphML,235,221,0.008037825059101654,1.8808510638297873,1.220232501689424,0.6487661490882684,0.6470409631729126,0.17491472814984438,0.11389295011758804,0.9994795918464661,0.0,0.0,0.0,0.0,0.0,False,15,151,0.6425531914893617,1.0,1.0,-0.2428411111251215,27,0.9090103155961228,18,0.07659574468085106,12.088830022075054,11.0,21.0,33.0,24.326128472183335,0.06022789896269392
pems-bay,pems-bay,original,/home/suleimane/master/main/master-main/data/GraphML/pems-bay.GraphML,325,2079,0.03948717948717949,12.793846153846154,6.782441039543886,0.5301330778864268,0.5085046887397766,0.3024704482391964,0.10002011805772781,0.9999991655349731,0.67370964210499,0.36636250565788214,0.6494298859771954,0.8129606394965085,0.5242426334344882,False,7,319,0.9815384615384616,1.0,1.0,0.5695754396245535,19,0.8198383044484713,67,0.20615384615384616,5.161570158317068,5.0,8.0,13.0,15.547299238527271,0.24234533910758127

outputs/backbone/pems-bay/pems-bay-by-glanb-with-alpah_filter0_3/md/report.md

### Rede Original

- Nos: 325 | Arestas: 2079 | Densidade: 0.0395
- Grau medio: 12.7938 | Forca media: 6.7824
- Clustering medio: 0.6737 | Eficiencia global: 0.2423 | Modularidade: 0.8198
- Caminho medio (gcc): 5.1616 | Componentes: 7 | Assortatividade: 0.5696

#### pems-bay-by-glanb-with-alpah_filter0_3

Informacoes basicas do backbone:
- Nos: 319 | Delta: -1.85%
- Arestas: 622 | Delta: -70.08%
- Densidade: 0.0123 | Delta: -68.94%
- Grau medio: 3.8997 | Forca media: 2.4914
- Componentes: 1 | Razao do componente gigante: 1.0000 | Delta GCC: +1.88%
- Clustering medio: 0.1668 | Delta: -75.25%
- Eficiencia global: 0.1746 | Delta: -27.94%
- Caminho medio (gcc): 7.3573 | Delta: +42.54%
- Modularidade: 0.8235 | Delta: +0.0036
- Assortatividade: 0.0077 | Delta: -0.5619
- Comunidades: 13 | Maior comunidade: 50
- Robustez aleatoria (AUC LCC): 0.3318 | Delta: -23.19%
- Robustez alvo (AUC LCC): 0.0916 | Delta: -65.90%