legacy/backbone-analisys-historical/pems-bay/pems-bay-by-disp_fil-with-alpah_filter0_3/csv/all_network_summary.csv

graph_name,dataset,role,source_path,num_nodes,num_edges,density,average_degree,average_strength,edge_weight_mean,edge_weight_median,edge_weight_std,edge_weight_min,edge_weight_max,average_clustering,average_weighted_clustering,transitivity,local_efficiency_mean,edge_overlap_mean,is_connected,num_connected_components,giant_component_size,giant_component_ratio,node_connectivity_gcc,edge_connectivity_gcc,degree_assortativity,num_communities,modularity,largest_community_size,largest_community_ratio,avg_path_length_gcc,median_path_length_gcc,p90_path_length_gcc,diameter_gcc,avg_weighted_distance_gcc,global_efficiency
pems-bay-by-disp_fil-with-alpah_filter0_3,pems-bay,backbone,/home/suleimane/master/main/master-main/data/GraphML/pems-bay-by-disp_fil-with-alpah_filter0_3.GraphML,325,858,0.016296296296296295,5.28,4.433782635652102,0.8397315597825951,0.8749342262744904,0.13329311927301046,0.4068290591239929,0.9999991655349731,0.6493393785701479,0.5569955775450403,0.6579716193656093,0.7508805339959187,0.5193193105780518,False,21,137,0.42153846153846153,1.0,1.0,0.7446902479559421,32,0.8976814062139393,42,0.12923076923076923,7.765671962215543,8.0,13.0,23.0,11.119640627130828,0.05363065229118556
pems-bay,pems-bay,original,/home/suleimane/master/main/master-main/data/GraphML/pems-bay.GraphML,325,2079,0.03948717948717949,12.793846153846154,6.782441039543886,0.5301330778864268,0.5085046887397766,0.3024704482391964,0.10002011805772781,0.9999991655349731,0.67370964210499,0.36636250565788214,0.6494298859771954,0.8129606394965085,0.5242426334344882,False,7,319,0.9815384615384616,1.0,1.0,0.5695754396245535,19,0.8198383044484713,67,0.20615384615384616,5.161570158317068,5.0,8.0,13.0,15.547299238527271,0.24234533910758127

old-proj/backbone/analisys/pems-bay/pems-bay-by-disp_fil-with-alpah_filter0_3/md/report.md

### Rede Original

- Nos: 325 | Arestas: 2079 | Densidade: 0.0395
- Grau medio: 12.7938 | Forca media: 6.7824
- Clustering medio: 0.6737 | Eficiencia global: 0.2423 | Modularidade: 0.8198
- Caminho medio (gcc): 5.1616 | Componentes: 7 | Assortatividade: 0.5696

#### pems-bay-by-disp_fil-with-alpah_filter0_3

Informacoes basicas do backbone:
- Nos: 325 | Delta: -0.00%
- Arestas: 858 | Delta: -58.73%
- Densidade: 0.0163 | Delta: -58.73%
- Grau medio: 5.2800 | Forca media: 4.4338
- Componentes: 21 | Razao do componente gigante: 0.4215 | Delta GCC: -57.05%
- Clustering medio: 0.6493 | Delta: -3.62%
- Eficiencia global: 0.0536 | Delta: -77.87%
- Caminho medio (gcc): 7.7657 | Delta: +50.45%
- Modularidade: 0.8977 | Delta: +0.0778
- Assortatividade: 0.7447 | Delta: +0.1751
- Comunidades: 32 | Maior comunidade: 42
- Robustez aleatoria (AUC LCC): 0.1376 | Delta: -68.15%
- Robustez alvo (AUC LCC): 0.0867 | Delta: -67.74%