old-proj/backbone/analisys/metr-la/metr-la-by-disp_fil-with-alpah_filter0_3/csv/metr-la_network_summary.csv

graph_name,dataset,role,source_path,num_nodes,num_edges,density,average_degree,average_strength,edge_weight_mean,edge_weight_median,edge_weight_std,edge_weight_min,edge_weight_max,average_clustering,average_weighted_clustering,transitivity,local_efficiency_mean,edge_overlap_mean,is_connected,num_connected_components,giant_component_size,giant_component_ratio,node_connectivity_gcc,edge_connectivity_gcc,degree_assortativity,num_communities,modularity,largest_community_size,largest_community_ratio,avg_path_length_gcc,median_path_length_gcc,p90_path_length_gcc,diameter_gcc,avg_weighted_distance_gcc,global_efficiency
metr-la-by-disp_fil-with-alpah_filter0_3,metr-la,backbone,/home/suleimane/master/main/master-main/data/GraphML/metr-la-by-disp_fil-with-alpah_filter0_3.GraphML,207,430,0.02016790957272173,4.154589371980676,3.0697334161127245,0.7388776943434117,0.7274152934551239,0.15821701652866887,0.36471205949783325,0.9998319149017334,0.41565447435012653,0.3268835229733219,0.41193021947101854,0.504447831199039,0.2891356769845142,False,12,187,0.9033816425120773,1.0,1.0,0.5374856825813394,24,0.8054743515906949,26,0.12560386473429952,9.92737622908401,10.0,17.0,27.0,15.45514631642512,0.1318801850084986
metr-la,metr-la,original,/home/suleimane/master/main/master-main/data/GraphML/metr-la.GraphML,207,1313,0.061582477369729376,12.68599033816425,5.144801216424951,0.4055498293221496,0.3212842345237732,0.2664214215354655,0.10008397698402405,0.9998319149017334,0.5484908174323528,0.22063398549839594,0.5510989624009818,0.7472739491051362,0.3876396025686644,False,2,206,0.9951690821256038,2.0,2.0,0.46162532528411615,8,0.6978109147260045,53,0.2560386473429952,5.063746152024627,5.0,9.0,13.0,15.559703731966676,0.27886506280697293

old-proj/backbone/analisys/metr-la/metr-la-by-disp_fil-with-alpah_filter0_3/md/report.md

### Rede Original

- Nos: 207 | Arestas: 1313 | Densidade: 0.0616
- Grau medio: 12.6860 | Forca media: 5.1448
- Clustering medio: 0.5485 | Eficiencia global: 0.2789 | Modularidade: 0.6978
- Caminho medio (gcc): 5.0637 | Componentes: 2 | Assortatividade: 0.4616

#### metr-la-by-disp_fil-with-alpah_filter0_3

Informacoes basicas do backbone:
- Nos: 207 | Delta: -0.00%
- Arestas: 430 | Delta: -67.25%
- Densidade: 0.0202 | Delta: -67.25%
- Grau medio: 4.1546 | Forca media: 3.0697
- Componentes: 12 | Razao do componente gigante: 0.9034 | Delta GCC: -9.22%
- Clustering medio: 0.4157 | Delta: -24.22%
- Eficiencia global: 0.1319 | Delta: -52.71%
- Caminho medio (gcc): 9.9274 | Delta: +96.05%
- Modularidade: 0.8055 | Delta: +0.1077
- Assortatividade: 0.5375 | Delta: +0.0759
- Comunidades: 24 | Maior comunidade: 26
- Robustez aleatoria (AUC LCC): 0.2662 | Delta: -41.61%
- Robustez alvo (AUC LCC): 0.1373 | Delta: -64.58%