backbone/analisys/metr-la/metr-la-by-disp_fil-with-alpah_filter0_4/csv/all_network_summary.csv

graph_name,dataset,role,source_path,num_nodes,num_edges,density,average_degree,average_strength,edge_weight_mean,edge_weight_median,edge_weight_std,edge_weight_min,edge_weight_max,average_clustering,average_weighted_clustering,transitivity,local_efficiency_mean,edge_overlap_mean,is_connected,num_connected_components,giant_component_size,giant_component_ratio,node_connectivity_gcc,edge_connectivity_gcc,degree_assortativity,num_communities,modularity,largest_community_size,largest_community_ratio,avg_path_length_gcc,median_path_length_gcc,p90_path_length_gcc,diameter_gcc,avg_weighted_distance_gcc,global_efficiency
metr-la-by-disp_fil-with-alpah_filter0_4,metr-la,backbone,/home/suleimane/master/main/master-main/data/GraphML/metr-la-by-disp_fil-with-alpah_filter0_4.GraphML,207,585,0.027437737441958633,5.6521739130434785,3.709402100763459,0.6562788332119966,0.6454678177833557,0.19504206651481867,0.25778821110725403,0.9998319149017334,0.41295320353291376,0.2952443665422295,0.4177545691906005,0.5427555111733856,0.28243382016006446,False,6,195,0.9420289855072463,1.0,1.0,0.5677302134622236,14,0.7742202768229955,34,0.1642512077294686,7.861802802008987,8.0,14.0,19.0,14.697126676297538,0.17219528301067594
metr-la,metr-la,original,/home/suleimane/master/main/master-main/data/GraphML/metr-la.GraphML,207,1313,0.061582477369729376,12.68599033816425,5.144801216424951,0.4055498293221496,0.3212842345237732,0.2664214215354655,0.10008397698402405,0.9998319149017334,0.5484908174323528,0.22063398549839594,0.5510989624009818,0.7472739491051362,0.3876396025686644,False,2,206,0.9951690821256038,2.0,2.0,0.46162532528411615,8,0.6978109147260045,53,0.2560386473429952,5.063746152024627,5.0,9.0,13.0,15.559703731966676,0.27886506280697293

backbone/analisys/metr-la/metr-la-by-disp_fil-with-alpah_filter0_4/md/report.md

### Rede Original

- Nos: 207 | Arestas: 1313 | Densidade: 0.0616
- Grau medio: 12.6860 | Forca media: 5.1448
- Clustering medio: 0.5485 | Eficiencia global: 0.2789 | Modularidade: 0.6978
- Caminho medio (gcc): 5.0637 | Componentes: 2 | Assortatividade: 0.4616

#### metr-la-by-disp_fil-with-alpah_filter0_4

Informacoes basicas do backbone:
- Nos: 207 | Delta: -0.00%
- Arestas: 585 | Delta: -55.45%
- Densidade: 0.0274 | Delta: -55.45%
- Grau medio: 5.6522 | Forca media: 3.7094
- Componentes: 6 | Razao do componente gigante: 0.9420 | Delta GCC: -5.34%
- Clustering medio: 0.4130 | Delta: -24.71%
- Eficiencia global: 0.1722 | Delta: -38.25%
- Caminho medio (gcc): 7.8618 | Delta: +55.26%
- Modularidade: 0.7742 | Delta: +0.0764
- Assortatividade: 0.5677 | Delta: +0.1061
- Comunidades: 14 | Maior comunidade: 34
- Robustez aleatoria (AUC LCC): 0.3372 | Delta: -26.02%
- Robustez alvo (AUC LCC): 0.2330 | Delta: -39.91%