backbone/analisys/pems-bay/pems-bay-by-disp_fil-with-alpah_filter0_3/csv/pems-bay_network_summary.csv

graph_name,dataset,role,source_path,num_nodes,num_edges,density,average_degree,average_strength,edge_weight_mean,edge_weight_median,edge_weight_std,edge_weight_min,edge_weight_max,average_clustering,average_weighted_clustering,transitivity,local_efficiency_mean,edge_overlap_mean,is_connected,num_connected_components,giant_component_size,giant_component_ratio,node_connectivity_gcc,edge_connectivity_gcc,degree_assortativity,num_communities,modularity,largest_community_size,largest_community_ratio,avg_path_length_gcc,median_path_length_gcc,p90_path_length_gcc,diameter_gcc,avg_weighted_distance_gcc,global_efficiency
pems-bay-by-disp_fil-with-alpah_filter0_3,pems-bay,backbone,/home/varlson/master/main/master-main/data/GraphML/pems-bay-by-disp_fil-with-alpah_filter0_3.GraphML,325,695,0.013200379867046533,4.276923076923077,3.774491262802711,0.8825249355473964,0.9050489664077759,0.10044083292156757,0.5683487057685852,0.9999991655349731,0.6035187035187034,0.5422962931437311,0.6459143968871596,0.6939416065416065,0.5038799649591016,False,32,108,0.3323076923076923,1.0,1.0,0.756063473911397,42,0.9060986749340563,35,0.1076923076923077,8.081689165801315,8.0,14.0,23.0,10.48425261931824,0.03785833541479944
pems-bay,pems-bay,original,/home/varlson/master/main/master-main/data/GraphML/pems-bay.GraphML,325,2079,0.03948717948717949,12.793846153846154,6.782441039543886,0.5301330778864268,0.5085046887397766,0.3024704482391964,0.10002011805772781,0.9999991655349731,0.67370964210499,0.36636250565788214,0.6494298859771954,0.8129606394965085,0.5242426334344882,False,7,319,0.9815384615384616,1.0,1.0,0.5695754396245535,19,0.8198383044484713,67,0.20615384615384616,5.161570158317068,5.0,8.0,13.0,15.547299238527271,0.24234533910758127

backbone/analisys/pems-bay/pems-bay-by-disp_fil-with-alpah_filter0_3/md/report.md

### Rede Original

- Nos: 325 | Arestas: 2079 | Densidade: 0.0395
- Grau medio: 12.7938 | Forca media: 6.7824
- Clustering medio: 0.6737 | Eficiencia global: 0.2423 | Modularidade: 0.8198
- Caminho medio (gcc): 5.1616 | Componentes: 7 | Assortatividade: 0.5696

#### pems-bay-by-disp_fil-with-alpah_filter0_3

Informacoes basicas do backbone:
- Nos: 325 | Delta: -0.00%
- Arestas: 695 | Delta: -66.57%
- Densidade: 0.0132 | Delta: -66.57%
- Grau medio: 4.2769 | Forca media: 3.7745
- Componentes: 32 | Razao do componente gigante: 0.3323 | Delta GCC: -66.14%
- Clustering medio: 0.6035 | Delta: -10.42%
- Eficiencia global: 0.0379 | Delta: -84.38%
- Caminho medio (gcc): 8.0817 | Delta: +56.57%
- Modularidade: 0.9061 | Delta: +0.0863
- Assortatividade: 0.7561 | Delta: +0.1865
- Comunidades: 42 | Maior comunidade: 35
- Robustez aleatoria (AUC LCC): 0.1069 | Delta: -75.26%
- Robustez alvo (AUC LCC): 0.0532 | Delta: -80.19%