backbone/analisys/metr-la/metr-la-by-disp_fil-with-alpah_filter0_3/csv/metr-la_network_summary.csv

graph_name,dataset,role,source_path,num_nodes,num_edges,density,average_degree,average_strength,edge_weight_mean,edge_weight_median,edge_weight_std,edge_weight_min,edge_weight_max,average_clustering,average_weighted_clustering,transitivity,local_efficiency_mean,edge_overlap_mean,is_connected,num_connected_components,giant_component_size,giant_component_ratio,node_connectivity_gcc,edge_connectivity_gcc,degree_assortativity,num_communities,modularity,largest_community_size,largest_community_ratio,avg_path_length_gcc,median_path_length_gcc,p90_path_length_gcc,diameter_gcc,avg_weighted_distance_gcc,global_efficiency
metr-la-by-disp_fil-with-alpah_filter0_3,metr-la,backbone,/home/varlson/master/main/master-main/data/GraphML/metr-la-by-disp_fil-with-alpah_filter0_3.GraphML,207,364,0.01707236996388537,3.5169082125603865,2.7280618260448106,0.7756988983396645,0.777692586183548,0.14061684556011103,0.44814854860305786,0.9998319149017334,0.39132735219691744,0.31883695339673795,0.4186046511627907,0.4646307798481711,0.29036935286935284,False,17,175,0.8454106280193237,1.0,1.0,0.47995114539428724,28,0.8314206561556154,24,0.11594202898550725,10.790344827586207,11.0,18.0,28.0,15.53717189789193,0.10716678970297681
metr-la,metr-la,original,/home/varlson/master/main/master-main/data/GraphML/metr-la.GraphML,207,1313,0.061582477369729376,12.68599033816425,5.144801216424951,0.4055498293221496,0.3212842345237732,0.2664214215354655,0.10008397698402405,0.9998319149017334,0.5484908174323528,0.22063398549839594,0.5510989624009818,0.7472739491051362,0.3876396025686644,False,2,206,0.9951690821256038,2.0,2.0,0.46162532528411615,8,0.6978109147260045,53,0.2560386473429952,5.063746152024627,5.0,9.0,13.0,15.559703731966676,0.27886506280697293

backbone/analisys/metr-la/metr-la-by-disp_fil-with-alpah_filter0_3/md/report.md

### Rede Original

- Nos: 207 | Arestas: 1313 | Densidade: 0.0616
- Grau medio: 12.6860 | Forca media: 5.1448
- Clustering medio: 0.5485 | Eficiencia global: 0.2789 | Modularidade: 0.6978
- Caminho medio (gcc): 5.0637 | Componentes: 2 | Assortatividade: 0.4616

#### metr-la-by-disp_fil-with-alpah_filter0_3

Informacoes basicas do backbone:
- Nos: 207 | Delta: -0.00%
- Arestas: 364 | Delta: -72.28%
- Densidade: 0.0171 | Delta: -72.28%
- Grau medio: 3.5169 | Forca media: 2.7281
- Componentes: 17 | Razao do componente gigante: 0.8454 | Delta GCC: -15.05%
- Clustering medio: 0.3913 | Delta: -28.65%
- Eficiencia global: 0.1072 | Delta: -61.57%
- Caminho medio (gcc): 10.7903 | Delta: +113.09%
- Modularidade: 0.8314 | Delta: +0.1336
- Assortatividade: 0.4800 | Delta: +0.0183
- Comunidades: 28 | Maior comunidade: 24
- Robustez aleatoria (AUC LCC): 0.2092 | Delta: -54.10%
- Robustez alvo (AUC LCC): 0.1095 | Delta: -71.74%