legacy/backbone-analisys-historical/wikivital-mathematics/wikivital-mathematics-by-disp_fil-with-alpah_filter0_3/csv/wikivital-mathematics_network_summary.csv

graph_name,dataset,role,source_path,num_nodes,num_edges,density,average_degree,average_strength,edge_weight_mean,edge_weight_median,edge_weight_std,edge_weight_min,edge_weight_max,average_clustering,average_weighted_clustering,transitivity,local_efficiency_mean,edge_overlap_mean,is_connected,num_connected_components,giant_component_size,giant_component_ratio,node_connectivity_gcc,edge_connectivity_gcc,degree_assortativity,num_communities,modularity,largest_community_size,largest_community_ratio,avg_path_length_gcc,median_path_length_gcc,p90_path_length_gcc,diameter_gcc,avg_weighted_distance_gcc,global_efficiency
wikivital-mathematics-by-disp_fil-with-alpah_filter0_3,wikivital-mathematics,backbone,/home/suleimane/master/main/master-main/data/GraphML/wikivital-mathematics-by-disp_fil-with-alpah_filter0_3.GraphML,1025,6763,0.012886814024390243,13.196097560975609,34.02341463414634,2.578293656661245,2.0,1.0890617631695232,2.0,16.0,0.30897735412218474,0.05105595148671377,0.2776779325847761,0.45233080787345137,0.16943716286088334,False,3,1021,0.9960975609756098,1.0,1.0,0.10000055676581802,12,0.6019719984644973,243,0.2370731707317073,3.4443701868602483,3.0,5.0,9.0,1.2998336484028135,0.316584599878856
wikivital-mathematics,wikivital-mathematics,original,/home/suleimane/master/main/master-main/data/GraphML/wikivital-mathematics.GraphML,1068,27079,0.04752552748614373,50.70973782771536,70.96067415730337,1.3993500498541305,1.0,0.8740935925775659,1.0,16.0,0.42784138547811584,0.03714857708494049,0.3213045302714614,0.686690247393493,0.22289019145289857,True,1,1068,1.0,1.0,1.0,-0.0021167647125451446,6,0.4550912264640957,335,0.3136704119850187,2.3055540929976237,2.0,3.0,4.0,1.3199575176690606,0.4652458208836276

legacy/backbone-analisys-historical/wikivital-mathematics/wikivital-mathematics-by-disp_fil-with-alpah_filter0_3/md/report.md

### Rede Original

- Nos: 1068 | Arestas: 27079 | Densidade: 0.0475
- Grau medio: 50.7097 | Forca media: 70.9607
- Clustering medio: 0.4278 | Eficiencia global: 0.4652 | Modularidade: 0.4551
- Caminho medio (gcc): 2.3056 | Componentes: 1 | Assortatividade: -0.0021

#### wikivital-mathematics-by-disp_fil-with-alpah_filter0_3

Informacoes basicas do backbone:
- Nos: 1025 | Delta: -4.03%
- Arestas: 6763 | Delta: -75.02%
- Densidade: 0.0129 | Delta: -72.88%
- Grau medio: 13.1961 | Forca media: 34.0234
- Componentes: 3 | Razao do componente gigante: 0.9961 | Delta GCC: -0.39%
- Clustering medio: 0.3090 | Delta: -27.78%
- Eficiencia global: 0.3166 | Delta: -31.95%
- Caminho medio (gcc): 3.4444 | Delta: +49.39%
- Modularidade: 0.6020 | Delta: +0.1469
- Assortatividade: 0.1000 | Delta: +0.1021
- Comunidades: 12 | Maior comunidade: 243
- Robustez aleatoria (AUC LCC): 0.4632 | Delta: -6.84%
- Robustez alvo (AUC LCC): 0.2722 | Delta: -36.75%